{
  "n": 100,
  "accuracy": 0.82,
  "ece": 0.064,
  "bins": [
    {
      "lo": 0.0,
      "hi": 0.2,
      "n": 5,
      "mean_confidence": 0.15,
      "accuracy": 0.20
    },
    {
      "lo": 0.2,
      "hi": 0.4,
      "n": 10,
      "mean_confidence": 0.32,
      "accuracy": 0.30
    },
    {
      "lo": 0.4,
      "hi": 0.6,
      "n": 15,
      "mean_confidence": 0.51,
      "accuracy": 0.47
    },
    {
      "lo": 0.6,
      "hi": 0.8,
      "n": 25,
      "mean_confidence": 0.71,
      "accuracy": 0.68
    },
    {
      "lo": 0.8,
      "hi": 1.0,
      "n": 45,
      "mean_confidence": 0.89,
      "accuracy": 0.87
    }
  ],
  "thresholds": [
    {
      "threshold": 0.5,
      "coverage": 0.95,
      "accuracy": 0.83
    },
    {
      "threshold": 0.7,
      "coverage": 0.85,
      "accuracy": 0.89
    },
    {
      "threshold": 0.85,
      "coverage": 0.55,
      "accuracy": 0.94
    }
  ],
  "by_question_type": {
    "perception": {
      "n": 60,
      "accuracy": 0.86,
      "ece": 0.051
    },
    "direct_action": {
      "n": 40,
      "accuracy": 0.76,
      "ece": 0.082
    }
  },
  "recommended_threshold": 0.70
}
