{
  "n": 15,
  "accuracy": 0.9333,
  "ece": 0.5964,
  "bins": [
    {
      "lo": 0.0,
      "hi": 0.1,
      "n": 0,
      "mean_confidence": 0.05,
      "accuracy": 0.0
    },
    {
      "lo": 0.1,
      "hi": 0.2,
      "n": 0,
      "mean_confidence": 0.15,
      "accuracy": 0.0
    },
    {
      "lo": 0.2,
      "hi": 0.3,
      "n": 0,
      "mean_confidence": 0.25,
      "accuracy": 0.0
    },
    {
      "lo": 0.3,
      "hi": 0.4,
      "n": 12,
      "mean_confidence": 0.3333,
      "accuracy": 1.0
    },
    {
      "lo": 0.4,
      "hi": 0.5,
      "n": 0,
      "mean_confidence": 0.45,
      "accuracy": 0.0
    },
    {
      "lo": 0.5,
      "hi": 0.6,
      "n": 1,
      "mean_confidence": 0.573,
      "accuracy": 1.0
    },
    {
      "lo": 0.6,
      "hi": 0.7,
      "n": 0,
      "mean_confidence": 0.65,
      "accuracy": 0.0
    },
    {
      "lo": 0.7,
      "hi": 0.8,
      "n": 2,
      "mean_confidence": 0.7596,
      "accuracy": 0.5
    },
    {
      "lo": 0.8,
      "hi": 0.9,
      "n": 0,
      "mean_confidence": 0.85,
      "accuracy": 0.0
    },
    {
      "lo": 0.9,
      "hi": 1.0,
      "n": 0,
      "mean_confidence": 0.95,
      "accuracy": 0.0
    }
  ],
  "thresholds": [
    {
      "threshold": 0.5,
      "coverage": 0.2,
      "accuracy": 0.6667
    },
    {
      "threshold": 0.55,
      "coverage": 0.2,
      "accuracy": 0.6667
    },
    {
      "threshold": 0.6,
      "coverage": 0.1333,
      "accuracy": 0.5
    },
    {
      "threshold": 0.65,
      "coverage": 0.1333,
      "accuracy": 0.5
    },
    {
      "threshold": 0.7,
      "coverage": 0.1333,
      "accuracy": 0.5
    },
    {
      "threshold": 0.75,
      "coverage": 0.0667,
      "accuracy": 0.0
    },
    {
      "threshold": 0.8,
      "coverage": 0.0,
      "accuracy": 0.0
    },
    {
      "threshold": 0.85,
      "coverage": 0.0,
      "accuracy": 0.0
    },
    {
      "threshold": 0.9,
      "coverage": 0.0,
      "accuracy": 0.0
    },
    {
      "threshold": 0.95,
      "coverage": 0.0,
      "accuracy": 0.0
    }
  ],
  "by_question_type": {
    "choice": {
      "n": 15,
      "accuracy": 0.9333,
      "mean_confidence": 0.4061,
      "ece": 0.5964
    }
  },
  "recommended_threshold": null
}